URL,Type,Number of Tags,Title,Time Posted
http://tcbunny.tumblr.com/post/167377182779/please-be-merciful-boys-3-girls-version-is-coming,photo,6,Please Be Merciful Boys 3 Girls Version Is Coming,2017-11-11 16:01:46 GMT
http://tcbunny.tumblr.com/post/167345462879/thank-you-for-likes-and-comments-there-will-be,photo,2,Thank You For Likes And Comments There Will Be,2017-11-10 17:58:24 GMT
http://tcbunny.tumblr.com/post/167197551554/too-many-text-sorry-haha-donation,photo,2,Too Many Text Sorry Haha Donation,2017-11-06 15:21:24 GMT
http://tcbunny.tumblr.com/post/167049958974/please-be-merciful-shoji-x-angie-shoji-you,photo,1,Please Be Merciful Shoji X Angie Shoji You,2017-11-02 14:31:56 GMT
http://tcbunny.tumblr.com/post/167014248624/s3-final-episode-d-finallyyyyyy-donation,photo,2,S3 Final Episode D Finallyyyyyy Donation,2017-11-01 14:18:11 GMT
http://tcbunny.tumblr.com/post/166813932049/this-episode-is-influenced-by-livingmores,photo,2,This Episode Is Influenced By Livingmores,2017-10-26 13:40:17 GMT
http://tcbunny.tumblr.com/post/166735047499/isnt-this-romantic-or-is-it-only-me,photo,2,Isnt This Romantic Or Is It Only Me,2017-10-24 04:37:35 GMT
http://tcbunny.tumblr.com/post/166567797004/happy-halloween-3-time-to-take-a-break-from,photo,5,Happy Halloween 3 Time To Take A Break From,2017-10-19 12:06:24 GMT
http://tcbunny.tumblr.com/post/166484664119/now-my-son-is-teaming-up-with-mr-bear,photo,2,Now My Son Is Teaming Up With Mr Bear,2017-10-17 01:36:41 GMT
http://tcbunny.tumblr.com/post/166358764844/ep08-is-here-warning-18-for-violence-blood,photo,2,Ep08 Is Here Warning 18 For Violence Blood,2017-10-13 14:13:25 GMT
http://tcbunny.tumblr.com/post/166033890144/ive-been-sleeping-less-than-5-hrs-last-few-days,photo,2,Ive Been Sleeping Less Than 5 Hrs Last Few Days,2017-10-04 07:07:21 GMT
http://tcbunny.tumblr.com/post/165898854454/back-to-back-episode-donation,photo,2,Back To Back Episode Donation,2017-09-30 14:37:30 GMT
http://tcbunny.tumblr.com/post/165864576619/i-feel-like-i-update-more-often-than-before,photo,2,I Feel Like I Update More Often Than Before,2017-09-29 14:01:36 GMT
http://tcbunny.tumblr.com/post/165822404709/hmmmmmmm-sure,photo,1,Hmmmmmmm Sure,2017-09-28 06:18:43 GMT
http://tcbunny.tumblr.com/post/165652752984/link-httpstapasioseriesplease-be-merciful,photo,2,Link Httpstapasioseriesplease Be Merciful,2017-09-23 14:46:33 GMT
http://tcbunny.tumblr.com/post/165571889954/being-an-adult-getting-whatever-toys-you-want,photo,2,Being An Adult Getting Whatever Toys You Want,2017-09-21 05:03:51 GMT
http://tcbunny.tumblr.com/post/165466728534/link-httpstapasioseriesplease-be-merciful,photo,2,Link Httpstapasioseriesplease Be Merciful,2017-09-18 06:58:58 GMT
http://tcbunny.tumblr.com/post/165166070329/link-httpstapasioseriesplease-be-merciful,photo,2,Link Httpstapasioseriesplease Be Merciful,2017-09-09 23:19:01 GMT
http://tcbunny.tumblr.com/post/164934465044/link-httpstapasioseriesplease-be-merciful,photo,2,Link Httpstapasioseriesplease Be Merciful,2017-09-03 15:15:09 GMT
http://tcbunny.tumblr.com/post/164719328059/wellat-least-its-yummy,photo,1,Wellat Least Its Yummy,2017-08-28 18:33:23 GMT
